{"app_env":"dev","database_url_presence":"SET_REDACTED","determinism_pins":{"ALLOW_NETWORK":"0","LANG":"C","LC_ALL":"C","SAFE_MODE":"1","TZ":"UTC"},"rails":{"allow_db_write":"0","allow_network":"0","db_read_authorized":true,"safe_mode":"1"},"retired_key_presence":{"DB_ALLOW_BRIDGE_IN_PROD":"UNSET","DB_BRIDGE_URL":"UNSET","DB_FORCE_BRIDGE":"UNSET"},"run_id":"ops03-rolefix-afdd3ab792724569a7c24f83","schema":"hde_epic038.ops03.env_presence.v1"}
